{"$schema":"https://json-schema.org/draft/2020-12/schema","$id":"https://zeroproxy.invalid/protocol/policy.schema.json","type":"object","additionalProperties":false,"required":["policy_version","source_kinds","resource_kinds","network_surfaces"],"properties":{"policy_version":{"const":2},"source_kinds":{"type":"array","uniqueItems":true,"items":{"type":"string"}},"resource_kinds":{"type":"array","uniqueItems":true,"items":{"type":"string"}},"network_surfaces":{"type":"array","items":{"type":"object","additionalProperties":false,"required":["name","action"],"properties":{"name":{"type":"string"},"action":{"enum":["route","gateway","stream","block","virtualize"]}}}}}}
