{"policy_version":2,"source_kinds":["ClassicScriptExternal","ClassicScriptInline","ModuleScript","DirectEvalScript","IndirectEvalScript","TimerString","FunctionBody","AsyncFunctionBody","GeneratorFunctionBody","AsyncGeneratorFunctionBody","EventHandler","JavaScriptURL","ClassicWorker","ModuleWorker","SharedClassicWorker","SharedModuleWorker","TargetServiceWorkerClassic","TargetServiceWorkerModule","WorkletModule"],"resource_kinds":["document","script","module","style","image","font","media","frame","worker","manifest","download"],"network_surfaces":[{"name":"fetch","action":"gateway"},{"name":"xhr","action":"gateway"},{"name":"eventsource","action":"gateway"},{"name":"websocket","action":"stream"},{"name":"webrtc","action":"block"},{"name":"webtransport","action":"block"},{"name":"navigation","action":"route"},{"name":"target-service-worker","action":"virtualize"}]}
